{
 "schema": "work_order/1",
 "id": "wo.rustmoor.counting_house.brass_keys",
 "revision": 1,
 "act": 1,
 "seal": "favour.counting_house",
 "band": {
  "min": 5,
  "max": 9
 },
 "asks": [
  {
   "item": "item.rustmoor.brass_key",
   "qty": 25
  }
 ],
 "reward": {
  "favour": 1,
  "crowns": 375
 },
 "request": "Twenty-five Brass Keys, uncut, to the Counting-House. Payment on delivery, entered in the House's books."
}
