{
 "schema": "work_order/1",
 "id": "wo.global.board.fixture_ore",
 "revision": 1,
 "act": 1,
 "seal": "favour.board",
 "band": {
  "min": 1,
  "max": 5
 },
 "asks": [
  {
   "item": "item.global.fixture_copper_ore",
   "qty": 3
  }
 ],
 "reward": {
  "favour": 1,
  "crowns": 40
 },
 "request": "Fixture request, handed in to a validator."
}
