{
 "schema": "work_order/1",
 "id": "wo.rustmoor.board.brass_ingots",
 "revision": 1,
 "act": 1,
 "seal": "favour.board",
 "band": {
  "min": 1,
  "max": 4
 },
 "asks": [
  {
   "item": "item.rustmoor.brass_ingot",
   "qty": 50
  }
 ],
 "reward": {
  "favour": 1,
  "crowns": 375
 },
 "request": "The Board of Gauges requests fifty Brass Ingots for routine maintenance. The city is entirely well, and thanks you for keeping it so."
}
