{
 "schema": "work_order/1",
 "id": "wo.rustmoor.counting_house.odd_spoons",
 "revision": 1,
 "act": 1,
 "seal": "favour.counting_house",
 "band": {
  "min": 10,
  "max": 14
 },
 "asks": [
  {
   "item": "item.rustmoor.odd_spoons",
   "qty": 33
  }
 ],
 "reward": {
  "favour": 1,
  "crowns": 380
 },
 "request": "The Counting-House will accept thirty-three Odd Spoons. The crests need not match. The House does not ask where you found them."
}
