{
 "schema": "work_order/1",
 "id": "wo.rustmoor.board.steel_ingots",
 "revision": 1,
 "act": 1,
 "seal": "favour.board",
 "band": {
  "min": 10,
  "max": 14
 },
 "asks": [
  {
   "item": "item.rustmoor.steel_ingot",
   "qty": 10
  }
 ],
 "reward": {
  "favour": 1,
  "crowns": 375
 },
 "request": "The Board of Gauges requires ten Steel Ingots. The Altitude Review is entirely routine, exactly as the Gazette has said."
}
