{
 "schema": "work_order/1",
 "id": "wo.rustmoor.stokers.steel_and_rations",
 "revision": 1,
 "act": 1,
 "seal": "favour.stokers",
 "band": {
  "min": 15,
  "max": 20
 },
 "asks": [
  {
   "item": "item.rustmoor.steel_ingot",
   "qty": 5
  },
  {
   "item": "item.rustmoor.rustmoor_ration",
   "qty": 48
  }
 ],
 "reward": {
  "favour": 1,
  "crowns": 416
 },
 "request": "Five Steel Ingots and forty-eight Rations to the Fellowship hall. Mother Ash will not say thank you, so the rest of us will."
}
